{
  "schema_version": 1,
  "key": "Personal/beta",
  "owner": "Personal",
  "name": "beta",
  "contributions": [
    {
      "url": "https://github.com/Personal/beta/pull/2",
      "created": "2024-01-03T12:00:00+00:00",
      "contrib_type": "pullRequest",
      "owner": "Personal",
      "repo": "beta",
      "number": 2,
      "title": "First pull request",
      "merged": true,
      "closes": []
    }
  ]
}
